{
  "run_id": "fixture-20260609",
  "started": "2026-06-09T19:30:00",
  "mode": "fixture",
  "scanned": ["T-fixture-sample"],
  "skipped": ["T-20260609-vcs-processkit-feedback"],
  "triaged": [
    { "item": "T-fixture-sample", "decision": "accept", "seed_title": "ProcessKit-rs: политика буфера DropOldest на Command (backward-compatible, opt-in)" }
  ],
  "planned": ["TASK-0005", "TASK-0006", "TASK-0007", "TASK-0008", "TASK-0009", "TASK-0010"],
  "errors": [],
  "notes": "Валидационный прогон P1 на СИНТЕТИЧЕСКОЙ фикстуре. Реальные comms/QUEUE не тронуты; T-20260609 пропущен. triage→accept; planner→6 подзадач; волны [[0005,0008,0009,0010],[0006],[0007]]."
}
